Post_ID,Project,Title,Content,Content_Type,Platforms,Scheduled_Date,Scheduled_Time,Hashtags,Media_Type,CTA,Link_URL,Status,Approval_Status,Notes
NIKAHX-004,NikahX,"Values Quiz: Find Your Match","What matters most to you? Career ambition? Family values? Spirituality? Our AI-powered values quiz pairs you with compatible matches. Try it now!","Community","Instagram;Twitter;TikTok;Facebook",2026-02-11,09:00 AM,"#NikahX #ValuesQuiz #Compatibility #MatchMaking #AI #IslamicMatch #PersonalityQuiz","Interactive","What are your top 3 values in a partner?","https://nikahx.example.com/values-quiz","Draft","Pending","Week 1 - Tuesday interactive"
NIKAHX-005,NikahX,"Expert Advice: Meaningful Conversations","How to move from matching to meaningful conversation? Our relationship coach shares 5 conversation starters that lead to real connection. Be authentic!","Educational","Twitter;Instagram;LinkedIn;Facebook",2026-02-11,12:00 PM,"#NikahX #RelationshipAdvice #Communication #Authenticity #Love #Dating #Tips","Text","What's your best first conversation starter?","https://nikahx.example.com/conversation-tips","Draft","Pending","Mid-day advice"
NIKAHX-006,NikahX,"Meet Our Matchmakers: The Human Touch","Behind every match is an algorithm AND a human. Our team of matchmakers reviews profiles to ensure quality connections. Science + soul = magic.","Community","Instagram;LinkedIn;Twitter;Facebook",2026-02-11,03:00 PM,"#NikahX #Matchmakers #TeamFeature #HumanTouch #Community #Relationship #Expertise","Carousel","Have you worked with a matchmaker before?","https://nikahx.example.com/matchmakers-team","Draft","Pending","Afternoon team feature"
NIKAHX-007,NikahX,"Muslim Marriage Traditions Around the World","From Pakistani Mehendi to Arab Zaffe - marriage traditions are beautiful. See how different cultures celebrate Islamic unions while staying true to values.","Educational","Instagram;Pinterest;Twitter;Facebook",2026-02-12,10:00 AM,"#NikahX #MuslimWeddings #Traditions #Culture #IslamicMarriage #Wedding #Celebration","Carousel","Which wedding tradition is your favorite?","https://nikahx.example.com/wedding-traditions","Draft","Pending","Week 1 - Wednesday traditions"
NIKAHX-008,NikahX,"Premium Feature Launch: Video Introductions","Now show, don't just tell. Premium members can record video introductions. See personality, hear voice, connect authentically. Upgrade now!","News","Instagram;Twitter;Facebook;TikTok;LinkedIn",2026-02-12,02:00 PM,"#NikahX #NewFeature #VideoIntro #Premium #Connection #Innovation #Dating","Video","Would you use video introductions?","https://nikahx.example.com/video-intro-feature","Draft","Pending","Afternoon feature launch"
NIKAHX-009,NikahX,"Parental Involvement: The Right Balance","Modern matchmaking respects autonomy AND family values. How much should parents be involved in your search? Let's discuss this beautifully complex topic.","Community","Twitter;Instagram;Facebook;LinkedIn",2026-02-12,06:00 PM,"#NikahX #Family #Relationships #Discussion #IslamicValues #Culture #Respect","Text","What's your stance on parental involvement?","https://nikahx.example.com/parental-discussion","Draft","Pending","Evening discussion"
NIKAHX-010,NikahX,"Love Letter: Why We Do This","We do this because everyone deserves love - authentic, faith-based, life-long love. NikahX isn't just an app; it's a movement toward meaningful marriage.","Inspirational","Instagram;Twitter;Facebook;LinkedIn;TikTok",2026-02-12,08:00 PM,"#NikahX #Mission #Love #Faith #MarriageGoals #IslamicValues #Purpose #Community","Text","What does meaningful marriage mean to you?","https://nikahx.example.com/our-mission","Draft","Pending","Night mission statement"
